<?xml version="1.0" encoding="UTF-8"?>

<Zoo_KLNSPG xmlns:xsi="http://www.w3.org/2001/XMLSchema-instance" xsi:noNamespaceSchemaLocation="XMLSchemaKLNSPG.xsd">

    <!-- Employee példányok-->
    <Employee emp_id="1">
        <first_name>Kovacs</first_name>
        <last_name>Janos</last_name>
        <birth_date>1979-11-02</birth_date>
        <sex>M</sex>
        <posts>
            <post>Kisallat gondozo</post>
            <post>Eteto</post>
            <post>Szemetszedo</post>
        </posts>
    </Employee>
    <Employee emp_id="2">
        <first_name>Jakab</first_name>
        <last_name>Jozsef</last_name>
        <birth_date>1954-12-06</birth_date>
        <sex>M</sex>
        <posts>
            <post>Terrarium takarito</post>
            <post>Gondnok</post>
            <post>Jegyszedo</post>
        </posts>
    </Employee>
    <Employee emp_id="3">
        <first_name>Balogh</first_name>
        <last_name>Boglarka</last_name>
        <birth_date>2000-11-04</birth_date>
        <sex>F</sex>
        <posts>
            <post>Gondozo</post>
            <post>Eteto</post>
            <post>Jegyszedo</post>
        </posts>
    </Employee>

    <!-- Site példányok-->
    <Site site_id="1" Works="3" Manage="1">
        <name>Miskolc Allatkert</name>
        <area>212000</area>
        <opening_hours>09:00 - 17:00</opening_hours>
    </Site>
    <Site site_id="2" Works="1" Manage="2">
        <name>Fovarosi Allat-es Novenykert</name>
        <area>184001</area>
        <opening_hours>09:00 - 17:30</opening_hours>
    </Site>
    <Site site_id="3" Works="2" Manage="3">
        <name>Debreceni Allatkert es Vidampark</name>
        <area>170000</area>
        <opening_hours>09:00 - 15:30</opening_hours>
    </Site>

    <!-- Habitat példányok-->
    <Habitat habitat_id="1" Occupy="3">
        <name>Medve park</name>
        <location>#3</location>
        <description>Az allatkerti medvek elohelye. Jelenleg harom medve talalhato itt, Jazmin, Andor es Matyko. Szeretik a latogatokat, mindig erdeklodve nezelodnek.</description>
    </Habitat>
    <Habitat habitat_id="2" Occupy="1">
        <name>Muflonok dombja</name>
        <location>#22</location>
        <description>Vadasparkunk muflonjai itt talalhatoak. Baratsagosak, turista kedvelok, szeretik a finom falatokat.</description>
    </Habitat>
    <Habitat habitat_id="3" Occupy="2">
        <name>Szurikatak szigete</name>
        <location>#18</location>
        <description>Ki ne imadna a kis erdeklodo szurikatakat. Nalunk rogton 4-et is orokbe fogadhat, vagy csak latogathat is.</description>
    </Habitat>

    <!-- Animal példányok-->
    <Animal animal_id="1">
        <name>Matyko</name>
        <racial>Medve</racial>
        <description>Az allatkert egyik kan medveje</description>
    </Animal>
    <Animal animal_id="2">
        <name>Kis Hegyes</name>
        <racial>Muflon</racial>
        <description>Az allatkert nosteny muflona</description>
    </Animal>
    <Animal animal_id="3">
        <name>Mokas</name>
        <racial>Szurikata</racial>
        <description>Az allatkert legfiatalabb szurikataja</description>
    </Animal>

    <!-- Food példányok-->
    <Food food_id="1">
        <name>Fagyasztott nyershus</name>
        <is_delicious>false</is_delicious>
        <companies>
            <company>Family Frost</company>
            <company>Magyar Zoldseg</company>
            <company>Eszkimo</company>
        </companies>
    </Food>
    <Food food_id="2">
        <name>Sargarepa</name>
        <is_delicious>true</is_delicious>
        <companies>
            <company>Allati zoldseg/gyumolcs</company>
            <company>Magyar Zoldseg</company>
            <company>Felix allati eledel</company>
        </companies>
    </Food>
    <Food food_id="3">
        <name>Sult husi</name>
        <is_delicious>true</is_delicious>
        <companies>
            <company>Frosty food</company>
            <company>Eszkimo</company>
            <company>Magyar zoldseg</company>
        </companies>
    </Food>

    <!-- Eat példányok-->
    <Eat eat_id="1" FoodEat="1" AnimalEat="3">
        <feeding_time>09:00:00 18:00:00</feeding_time>
    </Eat>
    <Eat eat_id="2" FoodEat="3" AnimalEat="1">
        <feeding_time>07:00:00 20:00:00</feeding_time>
    </Eat>
    <Eat eat_id="3" FoodEat="2" AnimalEat="2">
        <feeding_time>06:00:00 14:00:00 20:00:00</feeding_time>
    </Eat>    

    <!-- User példányok-->
    <User user_id="1" Favor="3">
        <username>Allatbarat</username>
        <password>allat123</password>
        <sex>M</sex>
        <first_name>Kiss</first_name>
        <last_name>Sandor</last_name>
        <post_code>8200</post_code>
        <city>Veszprem</city>
        <street>Petofi Sandor utca</street>
        <number>3</number>
    </User>
    <User user_id="2" Favor="1">
        <username>Vadoc</username>
        <password>fegyo02</password>
        <sex>M</sex>
        <first_name>Fegyver</first_name>
        <last_name>Sandor</last_name>
        <post_code>4024</post_code>
        <city>Debrecen</city>
        <street>Kossuth utca</street>
        <number>26</number>
    </User>
    <User user_id="3" Favor="2">
        <username>Possumluvr</username>
        <password>possumlover</password>
        <sex>F</sex>
        <first_name>Kazai</first_name>
        <last_name>Eszter</last_name>
        <post_code>3521</post_code>
        <city>Miskolc</city>
        <street>Uj elet utca</street>
        <number>24</number>
    </User>

</Zoo_KLNSPG>